paper_id	title
000538363800029	On the relationship between olfactory sensitivity and personality in HIV-seropositive and healthy men
000537457500012	Does Empathy Have a Cost? Older Adults and Social Partners Experiencing Problems
000537260800010	Getting a yes. An experiment on the power of asking
000536635400003	Adults' Dispositional and Situational Perspective-Taking: a Systematic Review
000534377300006	Activation in bed nucleus of the stria terminalis (BNST) corresponds to everyday helping
000534817400021	You not equal me: individual differences in the structure of social cognition
000532849000002	Respectful leadership and followers' knowledge sharing: A social mindfulness lens
000531517700002	Understanding How Minds Vary Relates to Skill in Inferring Mental States, Personality, and Intelligence
000529340200001	Microaggressions in the Learning Environment: A Systematic Review
000523598100022	How age-morphed images make Me feel: The role of emotional responses in building support for seniors
000518876800007	Class-based differences in the use of (aggressive) humor: The mediating role of empathic concern
000542004000001	The links between religiousness and prosocial behaviors in early adulthood: The mediating roles of media exposure preferences and empathic tendencies
000541585400001	On the Enjoyment of Sad Music: Pleasurable Compassion Theory and the Role of Trait Empathy
000541137300001	Compassionate Conservation Clashes With Conservation Biology: Should Empathy, Compassion, and Deontological Moral Principles Drive Conservation Practice?
000534863000002	Using virtual reality to optimize assessment of sociomoral skills
000540134000001	Feeling good: humanitarian virtual reality film, emotional style and global citizenship
000539390200001	Empathy-Related Brain Activity in Somatosensory Cortex Protects From Tactile Priming Effects: A Pilot Study
000534767200001	When Less Is More: How Complexity Impacts Goal Setting, Judgment Accuracy, and Deals in Negotiation
000539300400001	Reading the Mind in the Eyes of Children Test (RME-C-T): Development and Validation of a Complex Emotion Recognition Test
000534442000001	Exploring the Korean adolescent empathy using the Interpersonal Reactivity Index (IRI)
000541119500001	Impact Factors of Empathy in Mainland Chinese Youth
000534274300001	Predicting boundary violation propensity among mental health professionals
000536384400001	A factorial randomized controlled trial to examine separate and combined effects of a simulation-based empathy enhancement program and a lecture-based education program on family caregivers of people with dementia
000532846300001	Attachment and resource sharing
000537289200001	High School Student Burnout: Is Empathy a Protective or Risk Factor?
000533763700001	Empathy, mentalizing, and cognitive functioning in anorexia nervosa and bulimia nervosa
000533929000001	The Relationship Between System Justification and Perspective-Taking and Empathy
000534887300001	Investigative empathy: a strength scale of empathy based on European police perspectives
000531780300003	Referral for group or individual treatment? Factors for consideration in the case of self-referred individuals with a sexual interest in minors
000532426300001	'You can tell a victim by the tilt of her head as she walks': psychopathic personality and social-emotional processing
000536959700044	Connecting perceived economic threat and prosocial tendencies: The explanatory role of empathic concern
000579516800006	Female high-reassurance seekers are at risk for adolescent depression
000532592800007	An Investigation of Pre-Service Teachers' Attitudes Toward Animals and Empathy Toward Humans: Implications for Humane Education Development
000520391100010	Granting forgiveness: State and trait evidence for genetic and gender indirect effects through empathy
000591848800011	Sexual Offense, between Reason and the Heart: a Look from Cognitive and Emotional Processes
000565912900009	Effects of Biopsychosocial Education on the Clinical Judgments of Medical Students and GP Trainees Regarding Future Risk of Disability in Chronic Lower Back Pain: A Randomized Control Trial
000539300900195	Coercive Parenting and Adolescent Developmental Outcomes: The Moderating Effects of Empathic Concern and Perception of Social Rejection
000541379400007	Scrutinizing the grey areas of declarative memory: Do the self -reference and temporal orientation of a trait knowledge task modulate the Late Positive Component (LPC)?
000541036100055	Theory of Mind Performance Predicts tDCS-Mediated Effects on the Medial Prefrontal Cortex: A Pilot Study to Investigate the Role of Sex and Age
000535907200004	Multivariate Patterns of Posterior Cortical Activity Differentiate Forms of Emotional Distancing
000535745400064	Effectiveness of the Reasoning and Rehabilitation V2 Programme for Improving Personal and Social Skills in Spanish Adolescent Students
000535914600008	Effects of Age on Emotion Regulation, Emotional Empathy, and Prosocial Behavior
000535510400014	Alterations of empathy in mothers with a history of early life maltreatment, depression, and borderline personality disorder and their effects on child psychopathology
000535757900007	Interventions to Enhance Empathy and Person-Centered Care for Individuals With Dementia
000531702200003	Assessing the effects of an empathy education program using psychometric instruments and brain fMRI
000531775000011	Attachment styles as predictors of self-reported empathy in medical students during pre-clinical years
000525395400001	The Generation and Function of Moral Emotions in Teams: An Integrative Review
000536673200030	Emotional feedback ameliorates older adults' feedback-induced learning
000556598600001	Validation of the Toronto Empathy Questionnaire (TEQ) Among Medical Students in China: Analyses Using Three Psychometric Methods
000528127900001	Self-compassion in Relation to Alexithymia, Empathy, and Negative Mood in Young Adults
000527385800001	Facial expressions recognition and discrimination in Parkinson's disease
000527667400001	Sibling relationship dynamics relates to young adults' empathic responding
000527892400001	Apology and Restitution: Offender Accountability Responses Influence Victim Empathy and Forgiveness
000527176500001	Impact of Social Concern on Cyberbullying Perpetration in Iran: Direct, Indirect, Mediating, and Conditioning Effects in Agnew's Social Concern Theory
000518756400028	Prevalence, clinical correlates of suicide attempt and its relationship with empathy in patients with schizophrenia
000528584300001	Associations of emotional intelligence and gratitude with empathy in medical students
000526195700001	Older Adults' Beliefs About their Ability to Understand Others' Mental States
000562165400002	Links between autobiographical memory richness and temporal discounting in older adults
000527378200001	More than fantasy: Prosocial daydreams relate to prosocial dispositions and behaviour
000532019500001	College students' intentions to assist peers with chronic medical conditions
000527228200001	Disengagement is as revealing as prosocial action for young children's responding to strangers in distress: How personal distress and empathic concern come into play
000535959400031	Peripheral oxytocin is inversely correlated with cognitive, but not emotional empathy in schizophrenia
000524631800001	Psychometric properties of the Basic Empathy Scale in Polish children and adolescents
000524131800001	Exploring the links between alexithymia, empathy and schizotypy in college students using network analysis
000522871600001	Servant leadership and organizational citizenship behavior The mediating effect of empathy and service climate
000547006400003	Personal development groups during psychotherapy training: Irish students' expectations and experiences of vulnerability, safety and growth
000544460500008	A Theory of Wisdom Needs Theory of Mind
000526444100005	Empathy and Exposure to Credible Religious Acts during Childhood Independently Predict Religiosity
000531040500004	Prosocial motivations, empathy and gender diferences in adolescent victims of the armed conflict and lawbreakers
000569029500005	Influencing Social and Emotional Awareness and Empathy with a Visual Arts and Music Intervention for Adolescents
000563462200010	The unique social sense of puerperium: Increased empathy and Schadenfreude in parents of newborns
000551714500014	Factors associated with levels of empathy among students and professionals in the health field: a systematic review
000544018000011	Sorry by Size: How the Number of Apologizers Affects Apology Effectiveness
000531558100397	Can Climate Skeptics Be Convinced? The Effect of Nature Videos on Environmental Concern
000536956300001	Using Virtual Reality to Validate the Chinese Version of the Independent Television Commission-Sense of Presence Inventory
000530625600013	EFFECTS OF DEFAMATORY MESSAGES RECEIVED BY YOUNG PEOPLE THROUGH SMARTPHONES AND INFLUENCE OF THE CONTEXTS AND MEDIA OF RECEPTION
000526974000012	Emotion regulation and empathic abilities in young adults: The role of attachment styles
000525865200002	Empathy does not amplify vicarious threat learning
000524414900020	Modeling empathy: building a link between affective and cognitive processes
000524599200004	Counselor Empathy; Religiosity; and Lesbian, Gay, and Bisexual Perspectives
000522657000005	The ironic effect of deliberation: what we can (and cannot) expect in deeply divided societies
000522841400019	Amanah and Muslim Identity: Relationships with Religious and Psychological Adjustment in Malaysia
000521515400029	Selection and training of paraprofessionals in core parent-child interaction therapy skills
000519208800008	Adolescents' willingness to help with peer victimisation in Taiwan: The role of individual and situation-specific characteristics
000518808000005	Episodic Simulation Reduces Intergroup Bias in Prosocial Intentions and Behavior
000518808000010	Measuring Moral Politics: How Strict and Nurturant Family Values Explain Individual Differences in Conservatism, Liberalism, and the Political Middle
000519148600005	Lack of implicit visual perspective taking in adult males with autism spectrum disorders
000517885100002	Acute stress alters neural patterns of value representation for others
000507383700003	Wording Effect in the Measurement of Attitudes towards Dating Violence
000523375500001	Gender of partner affects the interaction pattern during group creative idea generation
000525678700001	Dissociating Profiles of Social Cognitive Disturbances Between Mixed Personality and Anxiety Disorder
000524687600001	The Development and Validation of a Multidimensional Forced-Choice Format Character Measure: Testing the Thurstonian IRT Approach
000523730800001	Depressive symptoms in parents are associated with reduced empathy toward their young children
000520520300001	Roses by other names? Empathy, sympathy, and compassion in mental health nursing
000558538200001	The right parietal lobe, sense of self, and empathy: cross-cultural, ethnic, and religious considerations
000523832600001	Developing a Family Achievement Guilt Scale Grounded in First-Generation College Student Voices
000525599800001	Social Cognition and Obsessive-Compulsive Disorder: A Review of Subdomains of Social Functioning
000525581200001	The Pacified Face: Early Embodiment Processes and the Use of Dummies
000519428200001	Exploring the relationship between mindfulness, compassion and unfamiliar face identification
000563994000002	Long-term effects and impact of a positive psychology intervention for Brazilian retirees
000523157200001	Creating a culture of respect and interprofessional teamwork on a labor and birth unit: a multifaceted quality improvement project
000519314100001	The Effect of an Intervention on College Students' Attitudes Towards People with Disabilities and Self-Directed Mobility
000523794300001	Adolescence, Empathy, and the Gender Gap in Delinquency
000517834000001	Developing leaders through mindfulness practice
000515537400003	Social mindfulness: Prosocial the active way
000562886200038	Audience spontaneous entrainment during the collective enjoyment of live performances: physiological and behavioral measurements
000588723800007	SELF-REPORT EMPATHY SCALES LACK CONSISTENCY: EVIDENCE FROM EXPLORATORY AND CONFIRMATORY FACTOR ANALYSIS
000549966200005	Development of the Mexican Version of the Empathy Quotient
000546965200010	Effect of a Responsiveness-Based Support Intervention on Smokeless Tobacco Cessation: The UCare-ChewFree Randomized Clinical Trial
000543490600005	"MINDFUL PARENTING: A PILOT STUDY OF THE ""BRIEF MINDFULNESS INTERVENTION PROGRAM"" (BMIP) IN THE EDUCATIONAL CONTEXT"
000537536300002	Pattern similarity and connectivity of hippocampal-neocortical regions support empathy for pain
000528261100003	Empathy training in health sciences: A systematic review
000528261100020	Predictors of psychological distress amongst nursing students: A multicenter cross-sectional study
000522389200181	Impact of Crisis Line Volunteering on Mental Wellbeing and the Associated Factors: A Systematic Review
000525858800007	Comparing Empathy Levels in Doctor of Pharmacy Students and Exemplary Pharmacist Preceptors
000525412600012	Improved quality of life and reduced depressive symptoms in medical students after a single-session intervention
000521958800006	Measuring morality in videogames research
000521113600016	Automatic imitation does not predict levels of prosocial behaviour in a modified dictator game
000520948600007	Lower digit ratio and higher endogenous testosterone are associated with lower empathic accuracy
000518474400005	A French adaptation of the Compassionate Love Scale for teachers: Validation on a sample of teachers and correlation with teacher autonomous motivation
000516711300004	Understanding How Others Feel: Evaluating the Relationship Between Empathy and Various Aspects of Emotion Recognition Following Severe Traumatic Brain Injury
000519875300005	Preliminary Development and Validation of a Scale to Measure Universal Love
000514247500004	Different faces of empathy: Feelings of similarity disrupt recognition of negative emotions
000516523100006	Does Virtue Lead to Status? Testing the Moral Virtue Theory of Status Attainment
000515209700004	Research on the formation of humanistic care ability in nursing students: A structural equation approach
000515415400011	Longitudinal Changes in Empathy Across the Life Span in Six Samples of Human Development
000513058500013	Is Mindfulness Associated With Interpersonal Forgiveness?
000513075500005	Reductions in perceived stress following Transcendental Meditation practice are associated with increased brain regional connectivity at rest
000509614900003	Interpersonal dominance-warmth dimensions of hostile and benevolent sexism: Insights from the self and friends
000509614900023	Individuals with dark traits have the ability but not the disposition to empathize
000510059900003	Strengths and Weaknesses of Two Empathy Measures: A Comparison of the Measurement Precision, Construct Validity, and Incremental Validity of Two Multidimensional Indices
000517501600001	Using the CNI Model to Investigate Individual Differences in Moral Dilemma Judgments
000516862800001	ERP evidence suggests that confrontation with deterministic statements aligns subsequent other- and self-relevant error processing
000516718300001	Collaborative Problem Solving reduces children's emotional and behavioral difficulties and parenting stress: Two key mechanisms
000524607800001	Rationale, Methods, Feasibility, and Preliminary Outcomes of a Transdiagnostic Prevention Program for At-Risk College Students
000515962000001	Youth Anxiety About Political News
000515920700002	Psychometric properties of the Chinese Empathy and Systemizing Quotients in a non-clinical sample
000515368000001	Compassion capability in resource-limited organizations in South Africa
000515387700001	Factors in the acquisition of ethical training
000515485300001	A multi-dimensional exploration of spirituality to empathy
000517231400002	Development in Danish medical students' empathy: study protocol of a cross-sectional and longitudinal mixed-methods study
000517239100001	When emotional intelligence predicts team performance: Further validation of the short version of the Workgroup Emotional Intelligence Profile
000514530200001	Child Abuse Taking Its Toll on the Emotional Well-Being of Pediatricians
000517131700001	Revisiting the trajectory of medical students' empathy, and impact of gender, specialty preferences and nationality: a systematic review
000515758300007	Empathy as a moderator of sexual violence perpetration risk factors among college men
000514172500008	Increased absorption in autonomous sensory meridian response
000514032000001	Empathic and Numerate Giving: The Joint Effects of Victim Images and Charity Evaluations
000509662600017	Electroencephalographic evidence for the involvement of mirror-neuron and error-monitoring related processes in virtual body ownership
000517528200001	Predicting Empathy From Resting State Brain Connectivity: A Multivariate Approach
000515410500001	Does the Political Candidate's Quality Lead to Satisfaction? Transposition of the SERVQUAL Model to Politics (VOTQUAL): Case of the Loyal Lebanese Voter
000514738600001	Longitudinal Effects of Cognitive and Affective Empathy on Adolescent Substance Use
000513966400001	Stress and Empathy in Teachers at General and Special Education Schools
000513582100001	Two facets of affective empathy: concern and distress have opposite relationships to emotion recognition
000516008300001	Mindfulness and Compassion as Key Factors in Improving teacher's Well Being
000512255100001	Family support, respect, and empathy as correlates of US Latino/Latina college students' prosocial behaviors toward different recipients
000517305200001	The Relation Between Empathy and Insight in Psychiatric Disorders: Phenomenological, Etiological, and Neuro-Functional Mechanisms
000515962200001	Does Empathy Pay? Evidence on Empathy and Salaries of Recent College Graduates
000515907100001	Nonattachment Predicts Empathy, Rejection Sensitivity, and Symptom Reduction After a Mindfulness-Based Intervention Among Young Adults with a History of Childhood Maltreatment
000515656100001	Study Protocol: Transitions in Adolescent Girls (TAG)
000549186700008	Assessment of medical student empathy: the French validation of the JSPE-MS (c)
000530895700004	Exploring Empathy, Compassion Fatigue, and Burnout among Feral Cat Caregivers
000528181900004	Peer defending as a multidimensional behavior: Development and validation of the Defending Behaviors Scale
000520946100006	Leader-follower transgressions, relationship repair strategies and outcomes: A state-of-the-science review and a way forward
000519614000012	Religiosity and Psychotic Ideation in Stable Schizophrenia: A Role for Empathic Perspective-Taking
000518843900010	Humor Styles and Empathy in Junior-School Children
000514253500022	Perceived school climate and adolescents' bullying perpetration: A moderated mediation model of moral disengagement and peers' defending
000518217500001	Giving to Friends, Classmates, and Strangers in Adolescence
000518217500004	A SNP, Gene, and Polygenic Risk Score Approach of Oxytocin-Vasopressin Genes in Adolescents' Loneliness
000518217500014	Is Self-Compassion Selfish? The Development of Self-Compassion, Empathy, and Prosocial Behavior in Adolescence
000517783300011	Bidirectional Associations across Time between Entitativity, Positive Affect, Generosity, and Religiousness in Adolescents Training with a Religiously Affiliated Charity Marathon Team
000514999700023	Mu-Suppression as an Indicator of Empathic Processes in Lesbian, Gay, and Heterosexual Adults
000516539500008	Prosociality Across Adolescence: a Large Cross-Sectional Study
000512817000002	Increasing self-other bodily overlap increases sensorimotor resonance to others' pain
000512927000023	How do perceptions of verbal statements and nonverbal actions as empathetic differ by medical appointment context?
000512949600007	Distinguishing between basic psychological needs and basic wellness enhancers: the case of beneficence as a candidate psychological need
000511913200001	Emotional intelligence, empathy and alexithymia in anorexia nervosa during adolescence
000509985700007	Different preferences for recovery options of residential fire disasters: The effect of decision role and stressed emotion
000510629500002	An inverted U-shaped relationship between heart rate deceleration and empathic emotions
000510388800003	More Than One Strategy: A Closer Examination of the Relationship Between Deep Acting and Key Employee Outcomes
000510595100002	A meta-analysis of the relationship between empathy and executive function
000508446800009	The enfacement illusion boosts facial mimicry
000506843600006	Nostalgia and Well-Being in Daily Life: An Ecological Validity Perspective
000504568700016	How Empathic Concern Fuels Political Polarization
000505184000007	Effects of student-generated feedback corresponding to answers to online student-generated questions on learning: What, why, and how?
000510331200001	Standing up or standing by: Bystander intervention in cyberbullying on social media
000515606000001	Dyadic and triadic search: Benefits, costs, and predictors of group performance
000515817100008	Reward and empathy in the treating clinician: the neural correlates of successful doctor-patient interactions
000508895700001	The empathy continuum: An evidenced-based teaching model derived from an integrative review of contemporary nursing literature
000512537400004	Economic system justification predicts muted emotional responses to inequality
000507802000003	The De-automatizing Function of Mindfulness Facets: an Empirical Test
000551461800001	Convergence of physiological responses to pain during face-to-face interaction
000507668000001	Understanding the relationship between traumatic suffering, posttraumatic growth, and prosocial variables
000507828200001	Empathy Is Not Enough: The Inhibiting Effects of Rape Myth Acceptance on the Relation Between Empathy and Bystander Intervention
000507809200001	Maternal acceptance-rejection, self-compassion and empathy in mothers of children with intellectual and developmental disabilities
000507186400001	Taking Responsibility for Others and Use of Mental Contrasting
000534350000103	The impact of peer attachment on prosocial behavior, emotional difficulties and conduct problems in adolescence: The mediating role of empathy
000512720700001	When brands use CEOs and employees as spokespersons A framework for understanding internal endorsement
000506131300001	A systematic review on empathy measurement tools for care professionals
000592251300001	The Long-Term Effectiveness of Empathic Interventions in Medical Education: A Systematic Review
000580448800003	Following in Jakobson and Levi-Strauss' footsteps: A neurocognitive poetics investigation of eye movements during the reading of Baudelaire's 'Les Chats'
000576064300001	Do pictures really say more than a thousand words? A network approach to early traumatic experience and empathic responding
000574070500001	Nurses' Empathetic Behaviors: The Direct and Indirect Effect of Their Spiritual Orientation
000562965000001	Default mode network modulation by mentalizing in young adults with autism spectrum disorder or schizophrenia
000560211200009	Punishing or helping: The influence of acute stress on third-party decision-making
000560169000001	Project-based learning approach to increase medical student empathy
000558057600081	Assessment Evaluation of Cognitive Factor and Work Stress Factors on Disaster Social Worker's Productivity in Indonesia
000550968100001	Harm inflation: Making sense of concept creep
000550070700001	Parental sense of competence, resilience, and empathy in relation fathers' responses to children's negative emotions in the context of everyday paternal childrearing decisions
000545015700018	Empathy impairments and its relation to behavior in patients with traumatic brain injury: A systematic review
000540715100004	Why People With High Alexithymia Make More Utilitarian Judgments The Role of Empathic Concern and Deontological Inclinations
000538801000001	Do All Types of Compassion Increase Prosocial Lying?
000537434300004	The role of trait empathy in the processing of observed actions in a false-belief task
000536630000002	Student Reflections with a Dyadic Objective Structured Clinical Examination (OSCE) Adapted for Social Work
000528220400006	One size does not fit all: gender implications for the design of outcomes, evaluation and assessment of science communication programs
000521955600159	Towards a Sustainable Model of Innovative Work Behaviors' Enhancement: The Mediating Role of Employability
000519979900010	Differential associations between interpersonal variables and quality-of-life in a sample of college students
000519207200001	The Characteristics of Moral Judgment of Psychopaths: The Mediating Effect of the Deontological Tendency
000518143400007	"How Caring Is ""Nullified"": Strong Racial Identity Eliminates White Participant Empathy Effects When Police Shoot an Unarmed Black Male"
000514819700044	Burnout among nursing students: predictors and association with empathy and self-efficacy
000513794400001	The Effectiveness of a ToM Training Program in Promoting Empathy Between Married Couples
000513291500010	Through the lens of history: The effects of beliefs about historical victimization on responses to refugees
000512533900001	Does the Interplay of Callous-Unemotional Traits and Moral Disengagement Underpin Disruptive Behavior? A Systematic Review
000511600500003	Incorporating Ethics Into Brief Mindfulness Practice: Effects on Well-Being and Prosocial Behavior
000510827000007	A BLESSING AND A CURSE: HOW CEOS' TRAIT EMPATHY AFFECTS THEIR MANAGEMENT OF ORGANIZATIONAL CRISES
