paper_id	title
000258270700012	Cross-cultural validation of the Empathy Quotient in a French-speaking sample
000306419600010	Empathy and moral emotions
000262657100044	Humor and empathy: Developing students' empathy through teaching robots to tell English jokes
000252988400003	Doing gender by doing emotion? Gender-specific development of the tendency to show sympathy in adolescence
000250237700001	Empathizing and systemizing in adults with and without autism spectrum conditions: Cross-cultural stability
000251792700002	Adolescent empathy and prosocial behavior in the multidimensional context of school culture
000247623700010	Effects of social influence on eating in couples, friends and strangers
000247466400002	Assessing empathy in prisoners - A shortened version of the Interpersonal Reactivity Index
000245133600009	Two sides of the same coin? The relations between prosocial and physically aggressive behaviors
000296322300009	Aggression and Violence in Adolescence
000248080900004	Perceived emotional intelligence facilitates cognitive-emotional processes of adaptation to an acute stressor
000246842900003	A latent growth curve analysis of prosocial behavior among rural adolescents
000242649100004	Empathy for adolescents' role model selection and learning of DVD content
000235390600008	Aggression, empathy and sexual orientation in males
000270454700014	LIFELONG LEARNING: HELPING ADDRESS DISADVANTAGE THROUGH COMMUNITY-BASED LEARNING PROJECTS
000234946500001	Patterns of mean-level change in personality traits across the life course: A meta-analysis of longitudinal studies
000231146300002	Age changes in prosocial responding and moral reasoning in adolescence and early adulthood
000226737500010	Truth, lies, and self-presentation: How gender and anticipated future interaction relate to deceptive behavior
000189146200001	Adolescent self-consciousness: Longitudinal age changes and gender differences in two cohorts
000182634600018	Spanish adaptation of the Interpersonal Reactivity Index.
000181195000018	Callous/unemotional traits and social-cognitive processes in adjudicated youths
000181286200009	The systemizing quotient: an investigation of adults with Asperger syndrome or high-functioning autism, and normal sex differences
000180471900005	Sociocognitive and behavioral correlates of a measure of prosocial tendencies for adolescents
000181753000019	Prosocial behavior, empathy, and sympathy
000173401200007	Biography and role playing: Fostering empathy in abnormal psychology
000179018700007	Emotional intelligence and leadership in adolescents
000176484600009	The role of reported emotion in real-life and hypothetical moral dilemmas
000175760500009	Prosocial development in early adulthood: A longitudinal study
000178080300003	The influences of sex and gender-role identity on moral cognition and prosocial personality traits
000174233800003	The development of a measure of prosocial behaviors for late adolescents
000171106800007	Emotional intelligence and interpersonal relations
000168693700002	Differences in the dispositional empathy of juvenile sex offenders, non-sex-offending delinquent juveniles, and nondelinquent juveniles
000167786800005	Distributive-justice reasoning in families with adolescents
000087015200004	Individual differences in emotional experience: Mapping available scales to processes
000167517500006	Dispositional empathy in scientist and practitioner psychologists: Group differences and relationship to self-reported professional effectiveness
000084872100001	The rank-order consistency of personality traits from childhood to old age: A quantitative review of longitudinal studies
000084294700008	Consistency and development of prosocial dispositions: A longitudinal study
000080045200002	The personality correlates of public and private self-consciousness from aFive-Factor perspective
000077361000003	A longitudinal study of self-awareness and depressed mood in adolescence
000075755400003	Is gender or gender-role orientation a better predictor of empathy in adolescence?
000076752900006	The importance of sex-of-stimulus object: Age trends and sex differences in empathic responsiveness
A1997XF90000002	Models of the self: Self-construals and gender
A1996VJ66500010	Self-consciousness in Chinese college students in Hong Kong
A1996VG28800015	How does young people's alcohol consumption change during the transition to early adulthood? A longitudinal study of changes at aggregate and individual level
A1996UK19300007	The relations of dispositional regulation and emotionality to elders' empathy-related responding and affect while volunteering
A1995RQ09400019	PROSOCIAL DEVELOPMENT IN LATE ADOLESCENCE - A LONGITUDINAL-STUDY
000591595800001	Focus on Opportunities or Limitations? Their Effects on Older Workers' Conflict Management
000592715700005	Roles of Age and Future Time Perspective of the Work Relationship in Conflict Management: A Daily Diary Study
000574291000006	Older and Less Deviant Reactions to Abusive Supervision? A Moderated Mediation Model of Age and Cognitive Reappraisal
000548665100016	Contribution of Wisdom to Well-Being in Chinese Older Adults
000544433200001	Frontline employee age and customer mistreatment: a meta-analysis
000534796000001	Is Work and Aging Research a Science of Questionnaires? Moving the Field Forward by Considering Perceived Versus Actual Behaviors
000457641200014	Effects of social identity salience on motivational orientation and conflict strategies in intergenerational conflict
000461182600001	Interpersonal conflict at work: Age and emotional competence differences in conflict management
000417722400005	Why Are Older People Often So Responsible and Considerate Even When Their Future Seems Limited? A Systematic Review
000424005800004	Predicting conflict acts using behavior and style measures
000375803300003	Lifespan Developmental Perspectives on Working: A Literature Review of Motivational Theories
000375803300004	Emotional Competencies Across Adulthood: State of Knowledge and Implications for the Work Context
000381313800001	Conflict management and age in service professions
000357389500006	Managing conflict at work: comparison between younger and older managerial employees
000375259800007	A LIFESPAN PERSPECTIVE ON EMOTION REGULATION, STRESS, AND WELL-BEING IN THE WORKPLACE
000310678800006	A Longitudinal Study of Age-Related Differences in Reactions to Psychological Contract Breach
000305302800001	AGE-RELATED DIFFERENCES IN GOALS: TESTING PREDICTIONS FROM SELECTION, OPTIMIZATION, AND COMPENSATION THEORY AND SOCIOEMOTIONAL SELECTIVITY THEORY
000299426900004	When I'm 64: Psychological contract breach, work motivation and the moderating roles of future time perspective and regulatory focus
000280954400003	Conflict Management in Online Relationships
000286081600007	Considerations for Managing an Increasingly Intergenerational Workforce in Libraries
A1996TV92200005	Distinguishing the effects of functional and dysfunctional conflict on strategic decision making: Resolving a paradox for top management teams
A1994PL11800003	RESOLVING THE PARADOX OF CONFLICT, STRATEGIC DECISION-MAKING, AND ORGANIZATIONAL PERFORMANCE
A1990CR56500008	COMPARATIVE FIT INDEXES IN STRUCTURAL MODELS
A1997YK83200006	Affective traits, responses to conflict, and satisfaction in romantic relationships
A1970I033700003	FIFTH ACHIEVEMENT
A1987J576000017	UTILITY OF CONFIRMATORY FACTOR-ANALYSIS IN TEST VALIDATION RESEARCH
A1987H184200021	THE STRUCTURE OF CONFLICT
A1993KG88100007	MARITAL CONFLICT AND CHILDREN - RETROSPECT AND PROSPECT
A1974S884500004	ATTITUDES TOWARDS OBJECTS AS PREDICTORS OF SINGLE AND MULTIPLE BEHAVIORAL CRITERIA
A1992JH48100004	MARITAL PROCESSES PREDICTIVE OF LATER DISSOLUTION - BEHAVIOR, PHYSIOLOGY, AND HEALTH
A1988N286100010	GOODNESS-OF-FIT INDEXES IN CONFIRMATORY FACTOR-ANALYSIS - THE EFFECT OF SAMPLE-SIZE
000081428600001	Patterns of styles in conflict management and effectiveness
A1995QT56000005	MANAGING-CONFLICT WITH A SUBORDINATE OR A SUPERIOR - EFFECTIVENESS OF CONGLOMERATED BEHAVIOR
000340719800002	Neurological and Biological Foundations of Children's Social and Emotional Development: An Integrated Literature Review
000337262100009	Is Empathizing intuitive and Systemizing deliberative?
000339427600001	Emotion and affect in mental imagery: do fear and anxiety manipulate mental rotation performance?
000338794300001	The relationship between different facets of empathy, pain perception and compassion fatigue among physicians
000338799800026	Sharing Social Touch in the Primary Somatosensory Cortex
000340305200003	Heartfelt imitation: High interoceptive awareness is linked to greater automatic imitation
000339663900009	Empathy in Narcissistic Personality Disorder: From Clinical and Empirical Perspectives
000338811400005	Individual differences in perspective taking and field-independence mediate structural persistence in dialog
000338743200001	An emotion-differentiated perspective on empathy with the emotion specific empathy questionnaire
000338621300004	Mirror, mirror on the wall, who's the fairest of them all? Thinking that one is attractive increases the tendency to support inequality
000338742400001	Moral judgment reloaded: a moral dilemma validation study
000338130300015	Performance-Based Empathy Mediates the Influence of Working Memory on Social Competence in Schizophrenia
000337679900011	Delivering good service: personal resources, job satisfaction and nurses' 'customer' (patient) orientation
000337203600011	Empathic resonance in Asperger syndrome
000337208900020	Cortisol increase in empathic stress is modulated by emotional closeness and observation modality
000341313200020	A pilot six-week randomized controlled trial of oxytocin on social cognition and social skills in schizophrenia
000336771400016	The canny social judge: Predicting others' attitudes from sparse information
000338673100001	Effect of empathy trait on attention to various facial expressions: evidence from N170 and late positive potential (LPP)
000338512200053	No Evidence that MDMA-Induced Enhancement of Emotional Empathy Is Related to Peripheral Oxytocin Levels or 5-HT1a Receptor Activation
000338280800005	How Do You Feel when You Can't Feel Your Body? Interoception, Functional Connectivity and Emotional Processing in Depersonalization-Derealization Disorder
000346490800001	Empathy and stress related neural responses in maternal decision making
000341869000029	The Influence of Affective Empathy and Autism Spectrum Traits on Empathic Accuracy
000349169700014	Bad Actions or Bad Outcomes? Differentiating Affective Contributions to the Moral Condemnation of Harm
000339005600004	Modeling What Friendship Patterns on Facebook Reveal About Personality and Social Capital
000337897500005	Relational Consequences of Personal Goal Pursuits
000337205900003	Language as a lightning rod: Power contests, emotion regulation, and subgroup dynamics in global teams
000336786300027	Altruism in the Wild: When Affiliative Motives to Help Positive People Overtake Empathic Motives to Help the Distressed
000336670100004	Watching television with others: The influence of interpersonal communication on entertainment
000336386700010	Anorexia nervosa and its relation to depression, anxiety, alexithymia and emotional processing deficits
000336798600012	Why Feasibility Matters More to Gift Receivers than to Givers: A Construal-Level Approach to Gift Giving
000337897500006	Perceived Perspective Taking: When Others Walk in Our Shoes
000335452000015	The relationship between default mode network connectivity and social functioning in individuals at familial high-risk for schizophrenia
000344826500001	Can we predict burnout severity from empathy-related brain activity?
000337542300001	Acute psychosocial stress and emotion regulation skills modulate empathic reactions to pain in others
000336109800005	Empathy, depressive symptoms, and social functioning among individuals with schizophrenia
000334722600006	A new conceptual framework for revenge firesetting
000336936400001	Reduced empathic concern leads to utilitarian moral judgments in trait alexithymia
000336064300001	The relationship between neurocognition and symptomatology in people with schizophrenia: social cognition as the mediator
000336029000001	The influence of empathic concern on prosocial behavior in children
000338213300053	Emotion Regulation Moderates the Association between Empathy and Prosocial Behavior
000335298000005	Empathy and Autobiographical Memory: Are They Linked?
000335298000006	Adolescents' Aggressive and Prosocial Behaviors: Links With Social Information Processing, Negative Emotionality, Moral Affect, and Moral Cognition
000331031700002	Active and observational reward learning in adults with autism spectrum disorder: relationship with empathy in an atypical sample
000346973500006	Alterations in empathic responding among women with posttraumatic stress disorder associated with childhood trauma
000337259500002	Validation of the Griffith Empathy Measure in the Chinese Context
000336885000005	Beyond physiological hypoarousal: The role of life stress and callous-unemotional traits in incarcerated adolescent males
000337133000002	Cynicism in negotiation: When communication increases buyers' skepticism
000336489000013	Neural evidence for an association between social proficiency and sensitivity to social reward
000336438400012	I'm Sorry About the Rain! Superfluous Apologies Demonstrate Empathic Concern and Increase Trust
000335123200013	Appropriate training based on Balint groups can improve the empathic abilities of medical students: A preliminary study
000334437700003	Narcissistic Personality Disorder: An Integrative Review of Recent Empirical Data and Current Definitions
000334178600004	Exploring Antecedents of Charitable Giving and Their Impact on Subjective Well-Being in Singapore
000334597500014	Impaired emotional empathy and related social network deficits in cocaine users
000336464100002	Fractionating theory of mind: A meta-analysis of functional brain imaging studies
000335097000011	Is stress affecting our ability to tune into others? Evidence for gender differences in the effects of stress on self-other distinction
000338006100001	The role of psychological detachment and empathy in the relationship between target and perpetrator in workplace bullying situations
000334105300001	Sharing and giving across adolescence: an experimental study examining the development of prosocial behavior
000334107500127	Empathy among Medical Students: Is There a Relation with Quality of Life and Burnout?
000334107500060	Developmental and Individual Differences in the Neural Processing of Dynamic Expressions of Pain and Anger
000349768000023	"Balancing the ""Inner"" and the ""Outer"" Self: Interoceptive Sensitivity Modulates Self-Other Boundaries"
000341512800007	ATTACHMENT STYLES AND DYADIC EMPATHY IN COUPLE RELATIONSHIPS IN EMERGING ADULTS
000339618100004	Spirituality and Intergroup Harmony: Meditation and Racial Prejudice
000337586200006	Extrinsic Cultural Religious Orientation: analysis of an Iranian measure in university students in the United States
000333410400030	The Impact of Simulated Medical Consultations on the Empathy Levels of Students at One Medical School
000336347700032	Empathic veterinarians score cattle pain higher
000335609900014	Mapping altruism
000333871000005	Friends Don't Let Friends Suffer From Depression: How Threat, Efficacy, Knowledge, and Empathy Relate to College Students'; Intentions to Intervene on Behalf of a Depressed Friend
000333260900015	Inability to empathize: brain lesions that disrupt sharing and understanding another's emotions
000332689300008	Learning about pain through observation: the role of pain-related fear
000333260900035	Right anterior temporal lobe dysfunction underlies theory of mind impairments in semantic dementia
000333946200025	Investigations on empathy towards humans and robots using fMRI
000333946200036	Sexism in online video games: The role of conformity to masculine norms and social dominance orientation
000332467900006	A PSYCHOLOGICAL PROFILE OF POTENTIAL YOUTH MENTOR VOLUNTEERS
000334184100009	Recovery of empathetic function following resection of insular gliomas
000339618100003	The Role of Mindfulness and Loving-Kindness Meditation in Cultivating Self-Compassion and Other-Focused Concern in Health Care Professionals
000336488700008	Taking one's time in feeling other-race pain: an event-related potential investigation on the time-course of cross-racial empathy
000332858400088	Individual Variation in Contagious Yawning Susceptibility Is Highly Stable and Largely Unexplained by Empathy or Other Known Factors
000347673400010	Good education for all? Student race and identity development in the multicultural classroom
000336504600010	Low Self-Awareness of Individuals With Severe Traumatic Brain Injury Can Lead to Reduced Ability to Take Another Person's Perspective
000332719000004	Sentimental Drivers of Social Entrepreneurship: A Study of China's Guangcai (Glorious) Program
000336437600007	The Moral Compass of Insecurity: Anxious and Avoidant Attachment Predict Moral Judgment
000331356100005	Speaking under pressure: Low linguistic complexity is linked to high physiological and emotional stress reactivity
000334391400004	Evidence of declining empathy in third year osteopathic medical students
000334033500009	Narcissism and Empathy in Young Offenders and Non-offenders
000333442200008	A Double-blind, Randomized Trial of Deep Repetitive Transcranial Magnetic Stimulation (rTMS) for Autism Spectrum Disorder
000332580900002	Impact of Job Involvement on Organizational Citizenship Behaviors in China
000332060100003	Stimulants improve theory of mind in children with attention deficit/hyperactivity disorder
000331528500008	Empowerment-Based Positive Youth Development: A New Understanding of Healthy Development for African American Youth
000330827500005	The Assessment of Susceptibility to Emotional Contagion: A Contribution to the Italian Adaptation of the Emotional Contagion Scale
000330827500008	The Relationship Between Narcissistic Exploitativeness, Dispositional Empathy, and Emotion Recognition Abilities
000333011500003	Effects of Empathy and Conflict Resolution Strategies on Psychophysiological Arousal and Satisfaction in Romantic Relationships
000331845700005	Relating Anatomical and Social Connectivity: White Matter Microstructure Predicts Emotional Empathy
000334248600007	Putting a Realistic Theory of Mind into Agency Theory: Implications for Reward Design and Management in Principal-Agent Relations
000331416200007	An occasion for unselfing: Beautiful nature leads to prosociality
000331951600019	Sharing pain and relief: neural correlates of physicians during treatment of patients
000329199300001	Empathy as a predictor of recidivism among young adult offenders
000330829200062	Neural Correlates of Receiving an Apology and Active Forgiveness: An fMRI Study
000339617700005	Relating Mindfully: A Qualitative Exploration of Changes in Relationships Through Mindfulness-Based Cognitive Therapy
000334816600009	Neurobiology of borderline personality disorder
000334429700004	To treat a psychopath
000331923700011	The Test of Accurate Perception of Patients' Affect (TAPPA): An ecologically valid tool for assessing interpersonal perception accuracy in clinicians
000331107300014	Increased neural reactivity to socio-emotional stimuli links social exclusion and aggression
000331376900003	Wage Cuts and Managers' Empathy: How a Positive Emotion Can Contribute to Positive Organizational Ethics in Difficult Times
000330382800010	Embarrassment and empathy before helping: How internal working models come into play
000330335300052	The extrastriate body area is involved in illusory limb ownership
000331705600003	The Extended Transportation-Imagery Model: A Meta-Analysis of the Antecedents and Consequences of Consumers' Narrative Transportation
000335288300006	Empathy, sympathy, and tax compliance
000336212800006	Long-Term Relations Among Prosocial-Media Use, Empathy, and Prosocial Behavior
000336488000014	Roman Catholic beliefs produce characteristic neural responses to moral dilemmas
000329302300007	Methodological and theoretical improvements in the study of superstitious beliefs and behaviour
000330513800001	Stress leads to prosocial action in immediate need situations
000331265500001	Intensive exposure to narrative in story books as a possibly effective treatment of social perspective-taking in schoolchildren with autism
000328074200017	Impaired empathic abilities and reduced white matter integrity in schizophrenia
000328929900001	Oxytocin receptor gene variation predicts empathic concern and autonomic arousal while perceiving harm to others
000328929900007	Are empathic abilities learnable? Implications for social neuroscientific research from psychometric assessments
000333484100004	The Influence of Personality on the Decision to Cheat
000327834300005	Self-compassion, empathy, and helping intentions
000327834300008	A meta-analysis of intergroup forgiveness
000327371800012	Neuropsychological, behavioral, and anatomical evolution in right temporal variant frontotemporal dementia: A longitudinal and post-mortem single case analysis
000358487000010	Empathy
000357262301005	What does it take for an individual to improvise? Exploring the antecedents of ad hoc co-improvisation
000354625200055	DIFFERENCES RECOGNIZING THE EMOTIONAL FACIAL EXPRESSIONS OF DIVERSE RACES IN KOREAN CHILDREN AND UNDERGRADUATES
000351467100004	Without Fellow Feeling
000349667800013	Self-reported empathy and neural activity during action imitation and observation in schizophrenia
000348454800008	Assessment of personality disorders according to DSM-5: Available instruments and limitations
000346237400002	Social Neuroscience and Theory of Mind
000345661400008	Mentalizing Functions Provide a Conceptual Link of Brain Function and Social Cognition in Major Mental Disorders
000343084100005	Can Teachers Know Learners' Minds? Teacher Empathy and Learner Body Language in English Language Teaching
000342290300016	Motivated empathy: The mechanics of the empathic gaze
000342313100004	Self-rated and performance-based empathy in schizophrenia: The impact of cognitive deficits
000340105900017	Cognitive and affective empathy in younger and older individuals
000338121400004	Empathic capacity of delinquent convicted minors
000335471200155	Teachers' self-concept and empathy
000336487400005	Cry for her or cry with her: context-dependent dissociation of two modes of cinematic empathy reflected in network cohesion dynamics
000336437300004	From a Distance ...: The Impact of Approach and Avoidance Motivational Orientation on Perspective Taking
000335889400005	Relationships Between Alexithymia, Affect Recognition, and Empathy After Traumatic Brain Injury
000332615400008	An Evaluation of Prepracticum Helping Skills Training for Graduate Social Work Students
000331254200005	The Suppression and Justification of Prejudice as a Function of Political Orientation
000330265400004	EMPATHY AND CONVERSATIONAL ENJOYMENT IN YOUNGER AND OLDER ADULTS
000329951700008	Paving the road to preferential treatment with good intentions: Empathy, accountability and fairness
000329951700010	An approach to test for individual differences in the effects of situations without using moderator variables
000328541000003	Testing the Psychometric Properties of the Scale of Ethnocultural Empathy in Turkey
000366603200042	People Help Robots Who Help Others, Not Robots Who Help Themselves
000383779804036	Practicing Engineers' Perceptions of Empathy and Care: Derived Exploratory Factor Structure from a 37-Item Survey
000380490600122	The People Part of Engineering Engineering For, With, and As People
000380490601143	Developing Novel Practices of Somatic Learning to Enhance Empathic Perspective-Taking for Ethical Reasoning and Engineering Design
000327884100003	Transitions between Subclasses of Bullying and Victimization when Entering Middle School
000454733300021	Online Perspective-Taking as an Intervention Tool Against Cyberbullying
000342358200001	Assessing social competencies in children and adolescents: Development and first validation of a questionnaire
000382878700006	Empathy and Violent Video Games: Aggression and Prosocial Behavior
000455229400102	Empathy and Yawn Contagion: Can we (Humans) Catch Yawns from Robots?
000455229400160	A Remote Social Robot to Motivate and Support Diabetic Children in Keeping a Diary
000396598200011	Emphatic Competences of Future Helpers
000338768000010	Alexithymia increases moral acceptability of accidental harms
000332373400008	Neuroanatomical Correlates of Executive Functions: A Neuropsychological Approach Using the EXAMINER Battery
000464092500001	All Else Being Equal: Overcoming the Egalitarian Norm
000349667600017	The neural basis of theory of mind and its relationship to social functioning and social anhedonia in individuals with schizophrenia
000348552800004	Moral character: What it is and what it does
000332375200003	The perception of realistic and symbolic threat and its influence on prejudice, ingroup favouritism and prosocial response: The native population in the face of immigration
000336487400004	Fact vs fiction-how paratextual information shapes our reading processes
000326963100012	EXPLORING PSYCHOLOGICAL FACTORS FOR CONTRIBUTING TO ONLINE RECOMMENDATION SITES
000326419200022	Who cares when nobody is watching? Psychopathic traits and empathy in prosocial behaviors
000329909800001	Preliminary evidence about the effects of meditation on interoceptive sensitivity and social cognition
000339617300008	Introducing Mindfulness as a Self-Care and Clinical Training Strategy for Beginning Social Work Students
000330824400018	Oxytocin sharpens self-other perceptual boundary
000330107200002	Psychometric properties of a Chinese version of the Jefferson Scale of Empathy-Health Profession Students
